{
  "schema_version": 2,
  "status": "non-certifying",
  "command": "./integration/r13/reproduce.sh --pending-placeholder",
  "started_at": "1970-01-01T00:00:00Z",
  "finished_at": "1970-01-01T00:00:01Z",
  "qualification": null,
  "fuzz": null,
  "reviews": null,
  "source": {
    "repository": "https://github.com/otuschhoff/rados-rs.git",
    "identity": "content-addressed-artifacts",
    "artifacts": {
      "PENDING_PLACEHOLDER_PATH": "0000000000000000000000000000000000000000000000000000000000000000"
    }
  },
  "server": {
    "repository": "https://github.com/ceph/ceph.git",
    "source_anchor_commit": "7f793731f1b39eb4f465e960113d2363c311b964",
    "version": "ceph version 20.2.4 (7f793731f1b39eb4f465e960113d2363c311b964) tentacle (stable)",
    "image": "quay.io/ceph/ceph@sha256:6e6bc7b28fa1b334108a3646af5533dfb50db508efdf5b358eb7dd0dd37a48aa",
    "platform": "linux/arm64",
    "binaries": {
      "mon_sha256": "0000000000000000000000000000000000000000000000000000000000000000",
      "osd_sha256": "0000000000000000000000000000000000000000000000000000000000000000"
    }
  },
  "cluster": {
    "fsid": "41111111-2222-4333-8444-131313131313",
    "network": "172.30.114.0/24",
    "monitors": ["v2:172.30.114.10:3300"],
    "osds": 3,
    "managers": 0,
    "manager_behavior_exercised": false,
    "pool": {
      "name": "r13-data",
      "size": 2,
      "min_size": 1,
      "pg_num": 16
    },
    "external_defaults": false,
    "service_ticket_ttl_seconds": 900,
    "transports": ["secure", "crc"]
  },
  "probe": {
    "secure": {
      "transport": "secure",
      "requested_duration_ns": 1,
      "elapsed_ns": 1,
      "monotonic_duration_satisfied": true,
      "operations": 1,
      "writes": 1,
      "reads": 1,
      "stats": 1,
      "removes": 1,
      "appends": 1,
      "append_once_verifications": 1,
      "duplicate_mutations_detected": 0,
      "reconnects": 0,
      "session_renewals": null,
      "longest_connection_ns": 1,
      "credential_renewals": null,
      "renewal_measurement": "completed renewal telemetry is unavailable through the public API; reported as null",
      "samples": [
        {"elapsed_ns": 0, "rss_bytes": 1, "threads": 1, "heap_bytes": 1, "inflight": null},
        {"elapsed_ns": 1, "rss_bytes": 1, "threads": 1, "heap_bytes": 1, "inflight": null}
      ],
      "inflight_measurement": "in-flight operation counts are unavailable through the public API; reported as null",
      "maximum_configured_sample_count": 2
    },
    "crc": {
      "transport": "crc",
      "requested_duration_ns": 1,
      "elapsed_ns": 1,
      "monotonic_duration_satisfied": true,
      "operations": 1,
      "writes": 1,
      "reads": 1,
      "stats": 1,
      "removes": 1,
      "appends": 1,
      "append_once_verifications": 1,
      "duplicate_mutations_detected": 0,
      "reconnects": 0,
      "session_renewals": null,
      "longest_connection_ns": 1,
      "credential_renewals": null,
      "renewal_measurement": "completed renewal telemetry is unavailable through the public API; reported as null",
      "samples": [
        {"elapsed_ns": 0, "rss_bytes": 1, "threads": 1, "heap_bytes": 1, "inflight": null},
        {"elapsed_ns": 1, "rss_bytes": 1, "threads": 1, "heap_bytes": 1, "inflight": null}
      ],
      "inflight_measurement": "in-flight operation counts are unavailable through the public API; reported as null",
      "maximum_configured_sample_count": 2
    }
  },
  "churn": {
    "monitor_restarts": 0,
    "monitor_recoveries": 0,
    "osd_restarts": 0,
    "osd_recoveries": 0,
    "final_osd_stat": {
      "epoch": 1,
      "num_osds": 3,
      "num_up_osds": 3,
      "num_in_osds": 3,
      "num_remapped_pgs": 0
    },
    "final_health": {
      "status": "HEALTH_OK",
      "checks": {},
      "mutes": []
    }
  },
  "benchmark": {
    "performed": false,
    "runs": []
  },
  "release": {
    "performed": false,
    "version": null,
    "path": null,
    "reproducible": false,
    "artifacts": {}
  }
}
